{
  "configurationInputs": [
    "Assets/VirtualVenueBaseballComponents/Scripts/VVBC.TSharp.asmdef",
    "Assets/VirtualVenueBaseballComponents/Editor/VVBC.Toolchain.Editor.asmdef",
    "Packages/org.vvbc.core/Runtime/VVBC.Runtime.asmdef",
    "Packages/org.vvbc.core/Runtime/VVBC.Runtime.UdonSharpAssembly.asset",
    "Packages/org.vvbc.core/package.json",
    "ProjectSettings/ProjectVersion.txt"
  ],
  "fixtureFiles": [
    {
      "canonical": "Tools/VVBC.Toolchain/Fixtures/Source/Toolchain/ToolchainFixtureBehaviour.cs",
      "staged": "Assets/VirtualVenueBaseballComponents/Scripts/Toolchain/ToolchainFixtureBehaviour.cs"
    },
    {
      "canonical": "Tools/VVBC.Toolchain/Fixtures/Source/Toolchain/ToolchainFixtureBehaviour.Tests.cs",
      "staged": "Assets/VirtualVenueBaseballComponents/Scripts/Toolchain/ToolchainFixtureBehaviour.Tests.cs"
    },
    {
      "canonical": "Tools/VVBC.Toolchain/Fixtures/TsukimiProgramAssets/ToolchainFixtureBehaviour.asset",
      "staged": "Assets/VirtualVenueBaseballComponents/Scripts/TsukimiProgramAssets/ToolchainFixtureBehaviour.asset"
    }
  ],
  "managedOutputs": {
    "Tools/VVBC.Toolchain/Fixtures/Generated/Toolchain/ToolchainFixtureBehaviour.cs": "6738521f429fd817ebfdf21d49ff0003385fdf7472ca62675ce6fc4b2023751e"
  },
  "productionRoots": [
    "Assets/VirtualVenueBaseballComponents/Scripts",
    "Tools/VVBC.Toolchain/Fixtures/Source"
  ],
  "programs": [
    {
      "id": "toolchain-regression",
      "inputFingerprint": "d7ba323c2d065b5b0f8b5178727d150afde541490a95a05c69ea3d91d11d278a",
      "module": "Toolchain",
      "outputs": [
        {
          "exportName": "ToolchainFixtureBehaviour.cs",
          "kind": "programEntry",
          "path": "Tools/VVBC.Toolchain/Fixtures/Generated/Toolchain/ToolchainFixtureBehaviour.cs",
          "typeName": "VVBC.Toolchain.Fixtures.ToolchainFixtureBehaviour"
        }
      ],
      "productionInputs": [
        "Tools/VVBC.Toolchain/Fixtures/Source/Toolchain/ToolchainFixtureBehaviour.cs"
      ],
      "programAsset": "Tools/VVBC.Toolchain/Fixtures/TsukimiProgramAssets/ToolchainFixtureBehaviour.asset",
      "scope": "fixture",
      "unityProgramAsset": "Assets/VirtualVenueBaseballComponents/Scripts/TsukimiProgramAssets/ToolchainFixtureBehaviour.asset",
      "unitySource": "Assets/VirtualVenueBaseballComponents/Scripts/Toolchain/ToolchainFixtureBehaviour.cs"
    }
  ],
  "schemaVersion": 1,
  "unityContext": "Tools/VVBC.Toolchain/unity-context.json",
  "versions": {
    "tsukimi": "0.10.1",
    "unity": "2022.3.22f1",
    "worlds": "3.10.5"
  }
}
